{
  "$schema": "https://json-schema.org/draft/2020-12/schema",
  "$id": "https://mechaminer.local/schemas/branch.schema.json",
  "title": "SCH-CNT-002 weapon branch definition",
  "description": "A weapon branch definition. The project-owned typed validator in src/MechaMiner.Content/Categories/ remains authoritative; this schema is the draft 2020-12 mirror kept for editor and tool interoperability, and a fixture corpus proves the two reach the same accept/reject verdict on every structural case. See content/schemas/README.md.",
  "type": "object",
  "additionalProperties": false,
  "propertyNames": {
    "$ref": "#/$defs/snake_case_field"
  },
  "required": [
    "id",
    "schema_version",
    "content_version",
    "status",
    "tags",
    "source_refs",
    "weapon_id",
    "branch_class",
    "cost_material_id",
    "cost_units",
    "behavior_kind",
    "effects",
    "exclusivity",
    "rules"
  ],
  "properties": {
    "id": {
      "title": "A stable, case-sensitive ASCII content ID",
      "type": "string",
      "pattern": "^W-[A-F]{2}(-[a-z0-9]+)+$"
    },
    "schema_version": {
      "$ref": "#/$defs/version"
    },
    "content_version": {
      "$ref": "#/$defs/version"
    },
    "status": {
      "$ref": "#/$defs/status"
    },
    "name_key": {
      "$ref": "#/$defs/name_key"
    },
    "summary_key": {
      "$ref": "#/$defs/summary_key"
    },
    "tags": {
      "$ref": "#/$defs/tags"
    },
    "source_refs": {
      "$ref": "#/$defs/source_refs"
    },
    "presentation_id": {
      "$ref": "#/$defs/presentation_id"
    },
    "weapon_id": {
      "type": "string",
      "pattern": "^W-[A-F]{2}$",
      "description": "The one weapon this branch registers against, which is the weapon this branch's own ID names. Exactly-one is structural here rather than a count: the field is a scalar, so an array of two is a type error."
    },
    "branch_class": {
      "type": "string",
      "description": "Which of the three transformation classes this branch is. The field is branch_class and never class: it says what the value classifies.",
      "enum": [
        "amplification",
        "functional",
        "conversion"
      ]
    },
    "cost_material_id": {
      "type": "string",
      "pattern": "^RSC-[0-9]{2}$",
      "description": "The resource this branch is fabricated from."
    },
    "cost_units": {
      "type": "integer",
      "description": "How many units it costs. A field rather than a constant: every accepted branch costs two, and the agreement is worth asserting from the data rather than assuming from the schema.",
      "minimum": 1,
      "x-authority": {
        "minimum": {
          "source": "TDD-CONTENT-DATA",
          "section": "Unit and numeric policy",
          "kind": "sourced",
          "derivation": "the section makes integer currency and rank values integral in source; a count of things that exist begins at one, because a count of zero is the absence of the field rather than a value of it"
        }
      }
    },
    "behavior_kind": {
      "type": "string",
      "description": "The registered behavior modifier. A lower-kebab-case token. Whether it resolves to exactly one registered behavior descriptor is the behavior registry's check and is deliberately not asserted here.",
      "pattern": "^[a-z][a-z0-9]*(-[a-z0-9]+)*$"
    },
    "effects": {
      "title": "A registry-owned parameter map",
      "description": "The modifier's parameters, keyed by its behavior kind. The key vocabulary belongs to the registered behavior descriptor rather than to this schema, so keys are not enumerated here; the strict codec still rejects a null, a duplicate key, and a non-snake_case key inside one.",
      "type": "object",
      "propertyNames": {
        "$ref": "#/$defs/snake_case_field"
      }
    },
    "exclusivity": {
      "title": "A branch's exclusivity",
      "description": "What committing to this branch rules out.",
      "type": "object",
      "additionalProperties": false,
      "properties": {
        "irreversible_within_run": {
          "type": "boolean",
          "description": "Whether committing to this branch lasts the run. The longer name is the accurate one: the rule it replaced scopes irreversibility to the run, and a branch is not irreversible across runs."
        },
        "mutually_exclusive_with": {
          "type": "array",
          "description": "The sibling branches installing this one rules out: exactly the other two of the same weapon.",
          "items": {
            "type": "string",
            "pattern": "^W-[A-F]{2}(-[a-z0-9]+)+$"
          },
          "uniqueItems": true,
          "minItems": 2,
          "maxItems": 2,
          "x-authority": {
            "minItems": {
              "source": "TDD-CONTENT-DATA",
              "section": "Weapons",
              "kind": "sourced",
              "derivation": "a weapon has three branches and installing one commits to it for the run, so each branch rules out the other two; the floor is three minus one and moves with the branch count"
            },
            "maxItems": {
              "source": "TDD-CONTENT-DATA",
              "section": "Weapons",
              "kind": "sourced",
              "derivation": "the same three minus one as the floor, and for the same reason: a branch that ruled out a third sibling would be naming a branch of some other weapon"
            }
          }
        }
      },
      "required": [
        "irreversible_within_run",
        "mutually_exclusive_with"
      ]
    },
    "global_attack_rate_mapping": {
      "title": "The global attack rate mapping",
      "description": "Arrays of timing names rather than one sentence each, so a future validator can check that every listed timing is a timing the weapon has. The timing vocabulary is not closed: no accepted document enumerates one, and closing it from fifteen authored sentences would be inventing it.",
      "type": "object",
      "additionalProperties": false,
      "properties": {
        "affected_timings": {
          "type": "array",
          "description": "The timings the global Attack Rate statistic reaches.",
          "items": {
            "type": "string"
          }
        },
        "unaffected_timings": {
          "type": "array",
          "description": "The timings it does not.",
          "items": {
            "type": "string"
          }
        }
      },
      "required": [
        "affected_timings",
        "unaffected_timings"
      ]
    },
    "expected_effect": {
      "title": "A branch's expected effect",
      "description": "One field, not the two field names that carried the same concept. qualitative is required and magnitude is omitted where unquantified, which is the shape that makes 'unquantified' expressible without a second field name.",
      "type": "object",
      "additionalProperties": false,
      "properties": {
        "qualitative": {
          "type": "string",
          "description": "The scene in which this branch is favourable."
        },
        "magnitude": {
          "title": "A registry-owned parameter map",
          "description": "The approximate magnitude, omitted where the effect is unquantified. The key vocabulary belongs to the registered behavior descriptor rather than to this schema, so keys are not enumerated here; the strict codec still rejects a null, a duplicate key, and a non-snake_case key inside one.",
          "type": "object",
          "propertyNames": {
            "$ref": "#/$defs/snake_case_field"
          }
        }
      },
      "required": [
        "qualitative"
      ]
    },
    "rules": {
      "type": "array",
      "description": "The accepted rule sentences for this branch.",
      "items": {
        "type": "string"
      }
    }
  },
  "$defs": {
    "snake_case_field": {
      "title": "A schema-declared field name",
      "description": "Property names use snake_case.",
      "type": "string",
      "pattern": "^[a-z][a-z0-9_]*$"
    },
    "version": {
      "title": "A positive integer version",
      "description": "The initial schema_version and content_version of every first-authored definition is 1.",
      "type": "integer",
      "minimum": 1,
      "x-authority": {
        "minimum": {
          "source": "TDD-CONTENT-DATA",
          "section": "Initial versions",
          "kind": "sourced",
          "derivation": "the initial value of every first-authored definition is 1 and both versions only ever increment, so no valid version is below 1; there is no upper bound because a definition may be revised without limit"
        }
      }
    },
    "status": {
      "title": "Lifecycle state",
      "type": "string",
      "enum": [
        "development",
        "enabled",
        "disabled",
        "retired"
      ]
    },
    "name_key": {
      "title": "Localization key for the player-facing name",
      "type": "string",
      "pattern": "^[a-z][a-z0-9_]*\\.[A-Za-z0-9][A-Za-z0-9_-]*\\.name$"
    },
    "summary_key": {
      "title": "Localization key for the concise player-facing summary",
      "type": "string",
      "pattern": "^[a-z][a-z0-9_]*\\.[A-Za-z0-9][A-Za-z0-9_-]*\\.summary$"
    },
    "tags": {
      "title": "Closed query and tooling vocabulary",
      "description": "The vocabulary starts empty, so [] is the only accepted value.",
      "type": "array",
      "uniqueItems": true,
      "items": {
        "type": "string",
        "enum": []
      }
    },
    "source_refs": {
      "title": "The sources this definition implements",
      "type": "array",
      "uniqueItems": true,
      "items": {
        "type": "string",
        "pattern": "^(?:[a-z][a-z0-9_]*(?:\\.[a-z][a-z0-9_]*|\\[\\]|\\[[0-9]+\\]|\\[[0-9]+\\.\\.[0-9]+\\])*: )?(?:(?:GDD|TDD)-[A-Z0-9-]+|DEC-[0-9]{3}|TDR-[0-9]{3}|TR-[A-Z]+-[0-9]{3})(?:#[a-z0-9-]+)?$"
      }
    },
    "presentation_id": {
      "title": "Logical presentation entry, required absent",
      "description": "Required absent: a definition carrying this field is an error. No accepted document says what a presentation definition contains, so no ID grammar has been minted for one, and minting a shape for a category with zero members would be inventing structure ahead of need. The field was declared-optional with a non-empty-string constraint, which accepted any string an author invented and validated nothing about it; rejecting the field outright fails loudly the first time somebody adds one instead of accepting an unauthorized value. The subschema is 'not' over the empty schema, which rejects every instance, so the fault is the field's presence rather than its shape and an authored empty string is rejected by the same rule rather than as an empty declared-optional field. The typed validator reports MMC-2010 and names the field. When an accepted document mints a presentation ID grammar, this declaration becomes that grammar; until then it has no minLength, because a length bound on a value that can never be authored explains nothing.",
      "not": {}
    }
  }
}
